{
  "$schema": "http://json-schema.org/draft-07/schema#",
  "title": "agentic-forge plugin config",
  "description": "Plugin configuration (ADR 0041). The SAME schema validates two files: the user-level ~/.agentic-forge/config.json (cross-project, ADR 0049) and the per-repo <repo>/.agentic-forge/config.json. Precedence: built-in defaults < user-level < per-repo < env vars. All keys are optional; omitted keys fall back to built-in defaults. A committed example with every key lives at plugin/config.example.json (see docs/configuration.md). These files are COMMITTED \u2014 do not put secrets (API keys, tokens) in them; use env vars for those.",
  "type": "object",
  "additionalProperties": false,
  "properties": {
    "diagnostics": {
      "type": "object",
      "additionalProperties": false,
      "properties": {
        "enabled": {
          "type": "boolean"
        }
      }
    },
    "subagent_budget": {
      "type": "object",
      "additionalProperties": false,
      "description": "Task-spawn caps; soft should be <= hard (soft warns, hard blocks).",
      "properties": {
        "soft": {
          "type": "integer",
          "minimum": 0
        },
        "hard": {
          "type": "integer",
          "minimum": 0
        }
      }
    },
    "test_gate": {
      "type": "object",
      "additionalProperties": false,
      "properties": {
        "skip": {
          "type": "boolean"
        }
      }
    },
    "review": {
      "type": "object",
      "additionalProperties": false,
      "properties": {
        "passes": {
          "type": "integer",
          "minimum": 1
        }
      }
    },
    "external_reviewer": {
      "type": "object",
      "additionalProperties": false,
      "description": "External reviewer CLI (increment 2). `command` is the executable name only (e.g. \"codex\") \u2014 not a shell line, and never an API key/secret (this file is committed).",
      "properties": {
        "enabled": {
          "type": "boolean"
        },
        "command": {
          "type": "string",
          "description": "A bare executable name on PATH (e.g. \"codex\") \u2014 not a path or shell line.",
          "pattern": "^[A-Za-z0-9][A-Za-z0-9_-]*$"
        }
      }
    },
    "models": {
      "type": "object",
      "description": "Tier/role -> model id (increment 4). E.g. {\"default\": \"claude-opus-4-8\", \"simple\": \"claude-sonnet-4-6\"}.",
      "additionalProperties": {
        "type": "string",
        "minLength": 1
      }
    },
    "pr_watcher": {
      "type": "object",
      "additionalProperties": false,
      "description": "PR watcher (ADR 0044/0045; autonomous mode 0063). Off by default; outward GitHub writes (push/reply/resolve/merge) are opt-in. Never force-pushes.",
      "properties": {
        "enabled": {
          "type": "boolean"
        },
        "bot": {
          "type": "string",
          "minLength": 1
        },
        "max_threads": {
          "type": "integer",
          "minimum": 1
        },
        "repos": {
          "type": "array",
          "description": "owner/name repos the scheduled hourly job watches (empty = none).",
          "uniqueItems": true,
          "items": {
            "type": "string",
            "pattern": "^[A-Za-z0-9._-]+/[A-Za-z0-9._-]+$"
          }
        },
        "auto_merge": {
          "type": "boolean",
          "description": "Let the watcher merge a PR once the merge gate opens (ADR 0063). OFF by default \u2014 merging is irreversible and outward-facing."
        },
        "merge_method": {
          "enum": [
            "rebase",
            "squash",
            "merge"
          ],
          "description": "How auto_merge merges. Reaches argv as --<method>, so it is an enum here and clamped again in the library."
        },
        "poll_seconds": {
          "type": "integer",
          "minimum": 60,
          "description": "Autonomous re-check cadence in seconds (default 600 = 10 min). This is ALSO the window an external PR reviewer gets: the gate cannot open before the first post-CI poll, so shortening it shortens that window."
        },
        "auto_watch": {
          "type": "boolean",
          "description": "Let the PR-created hook ENQUEUE a new PR for the scheduled watch (ADR 0068/0069). ON by default, but requires `enabled` too \u2014 with the watcher off the queue file is never created. Merging still requires auto_merge, which stays off: watching without merging is the safe middle setting."
        },
        "max_ticks": {
          "type": "integer",
          "minimum": 1,
          "description": "How many drains one queued PR may consume before it is dropped (default 144 = 24 h at the 10-minute cadence). Nothing is watched forever."
        }
      }
    },
    "state": {
      "type": "object",
      "additionalProperties": false,
      "description": "Where the plugin writes GENERATED state \u2014 logs, queues, job state (ADR 0072). Default: ~/.agentic-forge/state/<repo>/. This file itself is repo-scoped configuration and is unaffected.",
      "properties": {
        "in_repo": {
          "type": "boolean",
          "description": "Write generated state into <repo>/.agentic-forge/ instead of the user-level default. Off: a fresh run adds no untracked path to your repo."
        }
      }
    },
    "logs": {
      "type": "object",
      "additionalProperties": false,
      "description": "The PostToolUse audit trail (ADR 0019/0078).",
      "properties": {
        "enabled": {
          "type": "boolean",
          "description": "Write an audit record per tool call. On by default \u2014 it is the only record of what the agent did."
        },
        "max_bytes": {
          "type": "integer",
          "minimum": 1,
          "description": "Rotate the audit log once it exceeds this size. Default 10 MiB."
        },
        "keep_bytes": {
          "type": "integer",
          "minimum": 1,
          "description": "Bytes of the most recent records to keep in the live log when rotating. Default 5 MiB; the rest is gzipped into an archive beside it (see archives)."
        },
        "archives": {
          "type": "integer",
          "minimum": 0,
          "description": "How many gzipped archives of rotated-out records to keep beside the live log. Default 6; 0 discards them instead."
        }
      }
    },
    "pre_router": {
      "type": "object",
      "additionalProperties": false,
      "description": "The deterministic pre-router hook (ADR 0089): on each prompt, a lexical classifier over the skills' own trigger examples names the clearly-matching skill in the prompt's context. Suggests only, never invokes.",
      "properties": {
        "enabled": {
          "type": "boolean",
          "description": "Default false: measured at +0.095 activation over the SessionStart note (inside single-run noise) on a stand ADR 0090 found empty, so the null result is uninterpretable; stays off per ADR 0091. Overridable with AGENTIC_FORGE_PRE_ROUTER."
        }
      }
    },
    "routing_note": {
      "type": "object",
      "additionalProperties": false,
      "description": "The SessionStart note telling the session that agentic-forge skills are workflows to invoke (2026.9.3). On by default.",
      "properties": {
        "enabled": {
          "type": "boolean",
          "description": "Default true. Overridable with AGENTIC_FORGE_ROUTING_NOTE \u2014 the switch the note's own A/B uses (ADR 0092)."
        }
      }
    }
  }
}
