{
  "state": {
    "in_repo": false
  },
  "diagnostics": {
    "enabled": true
  },
  "subagent_budget": {
    "soft": 25,
    "hard": 50
  },
  "test_gate": {
    "skip": false
  },
  "review": {
    "passes": 3
  },
  "external_reviewer": {
    "enabled": true,
    "command": "codex"
  },
  "models": {},
  "pr_watcher": {
    "enabled": false,
    "bot": "github-actions[bot]",
    "max_threads": 10,
    "repos": [
      "owner/repo"
    ],
    "auto_merge": false,
    "merge_method": "rebase",
    "poll_seconds": 600,
    "auto_watch": true,
    "max_ticks": 144
  },
  "logs": {
    "enabled": true,
    "max_bytes": 10485760,
    "keep_bytes": 5242880,
    "archives": 6
  },
  "pre_router": {
    "enabled": false
  }
}
